title,description,company,location,deadline
"Software Engineer","We are looking for a software engineer to join our team. Must be proficient in Python and Django.","Tech Corp","San Francisco, CA","2026-02-15"
"Data Scientist","Join our data science team and work on exciting projects using machine learning and statistical analysis.","Data Inc.","New York, NY","2026-02-20"
"Product Manager","We are hiring a product manager to lead our new product line. Requires 5+ years of experience.","Innovate LLC","Austin, TX","2026-03-01"
"UX Designer","Design beautiful and intuitive user experiences for our customers. Portfolio required.","Designify","Remote","2026-02-28"
"Marketing Manager","Develop and execute marketing campaigns. Strong understanding of SEO and content marketing needed.","MarketPro","Chicago, IL","2026-03-10"
"DevOps Engineer",,"Cloud Solutions","Boston, MA","2026-03-15"
"Human Resources Generalist","Manage recruiting, onboarding, and employee relations.","People First Co.","Seattle, WA","2026-03-05"
"Graphic Designer","Create visually stunning graphics for web and print. Proficient in Adobe Creative Suite.","Creative Minds","Los Angeles, CA","2026-03-20"
